[
  {
    "_id": "000000010000010001e64c00",
    "name": "Top",
    "description": "All system wide settings, users, permissions, rights ",
    "createdWhen": "2014-11-13T01:00:00+00:00",
    "schemaRef": "of://node.json",
    "canRead": [
      "000000010000010001e64c28"
    ],
    "canWrite": [
      "000000010000010001e64c28"
    ],
    "allowedChildTypes": [
      "of://node.json"
    ]
  },
  {
    "_id": "000000010000010001e64c23",
    "parent_id": "000000010000010001e64c00",
    "name": "Administration",
    "description": "All system wide settings, users, permissions, rights ",
    "createdWhen": "2014-11-13T01:00:00+00:00",
    "schemaRef": "of://node.json",
    "canRead": [
      "000000010000010001e64c28"
    ],
    "canWrite": [
      "000000010000010001e64c28"
    ],
    "allowedChildTypes": [
      "of://node.json"
    ]
  },
  {
    "_id": "000000010000010001e64c24",
    "parent_id": "000000010000010001e64c23",
    "name": "Groups",
    "description": "All groups and their settings",
    "createdWhen": "2014-11-13T01:00:00+00:00",
    "schemaRef": "of://node.json",
    "canRead": [
      "000000010000010001e64c28"
    ],
    "canWrite": [
      "000000010000010001e64c28"
    ],
    "allowedChildTypes": [
      "of://group.json"
    ]
  },
  {
    "_id": "000000010000010001e64c25",
    "parent_id": "000000010000010001e64c23",
    "name": "Users",
    "description": "All users and their settings",
    "createdWhen": "2014-11-13T01:00:00+00:00",
    "schemaRef": "of://node.json",
    "canRead": [
      "000000010000010001e64c28"
    ],
    "canWrite": [
      "000000010000010001e64c28"
    ],
    "allowedChildTypes": [
      "of://user.json"
    ]
  },
  {
    "_id": "000000010000010001e64c26",
    "parent_id": "000000010000010001e64c23",
    "name": "Rights",
    "description": "All the defined rights and their settings",
    "createdWhen": "2014-11-13T01:00:00+00:00",
    "schemaRef": "of://node.json",
    "canRead": [
      "000000010000010001e64c28"
    ],
    "canWrite": [
      "000000010000010001e64c28"
    ],
    "allowedChildTypes": [
      "of://right.json"
    ]
  },
  {
    "_id": "000000010000010002e64d03",
    "parent_id": "000000010000010001e64c00",
    "name": "Peers",
    "description": "The peers in the Optimal BPM system",
    "createdWhen": "2014-11-13T01:00:00+00:00",
    "schemaRef": "of://node.json",
    "canRead": [
      "000000010000010001e64c28",
      "000000010000010001e64d02"
    ],
    "canWrite": [
      "000000010000010001e64c28",
      "000000010000010001e64d02"
    ],
    "allowedChildTypes": [
      "of://node_broker.json",
      "of://node_admin.json",
      "of://node_peer.json",
      "bpm://node_agent.json"
    ]
  },
  {
    "_id": "000000010000010002e64d17",
    "parent_id": "000000010000010002e64d03",
    "name": "admin_root",
    "description": "The settings of the web admin interface for the user root",
    "createdWhen": "2014-11-13T01:00:00+00:00",
    "schemaRef": "of://node_admin.json",
    "address": "admin_root",
    "canRead": [
      "000000010000010001e64c28",
      "000000010000010001e64d02"
    ],
    "canWrite": [
      "000000010000010001e64c28",
      "000000010000010001e64d02"
    ],
    "allowedChildTypes": []
  }
]